,Dish Name ,Short Description,Long Description,Dairy,Gluten,Calories,Protein (g),Fat (g),Fiber (g),Net Carbs (g)
Chef Special,Braised Short Rib,Braised Short Rib and Red Wine Reduction with Roasted Rainbow Carrots and Broccoli over Toasted Brown Rice,"Slow-braised short rib, finished with a rich red wine reduction, served with roasted rainbow carrots and broccoli over nutty toasted brown rice for a classic, steakhouse-inspired dish with a refined finish.",Dairy Free,Gluten Free,774,57,43,8,40
Chicken,Blackened Chicken,Blackened Chicken and Smoky Honey Harissa BBQ Glaze with Charred Zucchini and Roasted Cauliflower over Cilantro Lime Rice,"Bold blackened chicken glazed with a smoky honey harissa BBQ sauce, paired with charred zucchini and roasted cauliflower over bright cilantro lime rice for a balanced sweet-heat bowl with a fresh finish.",Dairy Free,Gluten Free,718,59,30,5,52
Beef,Birria Beef,Birria Beef and Salsa Verde with Fajita Vegetables over Sazon Rice,"Slow-cooked birria beef with a birria consome topped with vibrant salsa verde and served with fajita vegetables over savory sazon rice for a deeply flavorful dish with a bright, herbaceous lift.",Dairy Free,Gluten Free,786,55,41,5,49
Seafood,Red Curry Shrimp,Red Curry Shrimp and Coconut Curry Sauce with Green Beans and Red Bell Peppers over Jasmine Rice,"Tender shrimp in a fragrant coconut red curry sauce with green beans and red bell peppers over jasmine rice, delivering a smooth, aromatic curry with balanced heat and a clean finish.",Dairy Free,Gluten Free,528,54,12,8,51
Broth,Classic Bone Broth,Our classic high protein and collagen-rich chicken bone broth slow-simmered for 24 hours,Our classic chicken bone broth slow-simmered for 24 hours with fresh herbs and spices.,Dairy Free,Gluten Free,419,41,26,,6
Chia,Tiramisu Chia Pudding,Tiramisu chia pudding with granola topped with a layer of Biscoff cookie crumble,"Creamy espresso-vanilla chia pudding layered with a lightly sweet tiramisu-style cream, finished with a cocoa dusting and Biscoff cookie crumble for a rich, dessert-inspired treat with the perfect crunch",Dairy (Yogurt),Gluten Free,375,27,13,12,38