,Dish Name ,Short Description,Long Description,Dairy,Gluten,Calories,Protein (g),Fat (g),Fiber (g),Net Carbs (g)
Chef Special,Smash Burger Bowl,Seasoned Ground Beef with a Smoky Special Burger Sauce and Caramelized Onions and Apple Cider Cabbage Slaw over Roasted Sweet Potato Wedges,"Seasoned ground beef finished with a smoky special burger sauce, served with caramelized onions and a crisp apple cider cabbage slaw over roasted sweet potato wedges for a bold, craveable plate with a nostalgic, American finish.",Dairy (Special Sauce),Gluten Free,687,52,39,6,32
Chicken,Miso Garlic Chicken,Miso Garlic Chicken with a White Miso Glaze and Charred Broccolini and Roasted Mushrooms over Jasmine Rice,"Tender miso garlic chicken finished with a savory white miso glaze, served with charred broccolini and roasted mushrooms over jasmine rice for a rich, umami forward plate with a warm, savory finish.",Dairy Free,Gluten Free,644,60,23,7,50
Beef,Carne Asada Steak,Carne Asada Steak with a Chimichurri and Roasted Sweet Plantains and Pickled Red Onions over Sazon Rice,"Marinated carne asada steak finished with a bright chimichurri, served with roasted sweet plantains and pickled red onions over sazon rice for a vibrant, Latin inspired plate with a fresh, herbaceous finish.",Dairy Free,Gluten Free,770,54,36,4,58
Seafood,Honey Garlic Shrimp,Honey Garlic Shrimp with a Sticky Honey Garlic Glaze and Charred Broccoli and Roasted Red Peppers over Brown Rice,"Tender honey garlic shrimp finished with a sticky honey garlic glaze, served with charred broccoli and roasted red peppers over brown rice for a sweet, savory plate with a rich, caramelized finish.",Dairy Free,Gluten Free,574,57,8,7,67
Veg,Chickpea Tikka Masala,Seared Tofu in a Creamy Tikka Masala with Roasted Cauliflower and Chickpeas over Quinoa,"Crispy seared tofu in a rich creamy tikka masala, served with roasted cauliflower and chickpeas over quinoa for a warm, aromatic plate with a bold, comforting finish.",Dairy (Cream),Gluten Free,634,51,27,16,47
Broth,Golden Broth,Our golden high protein and collagen rich turmeric and coconut milk bone broth slow-simmered for 24 hours,"Our golden turmeric and coconut milk bone broth slow-simmered for 24 hours with fresh ginger and warming spices.",Dairy Free,Gluten Free,432,36,29,,7
Chia,Mango Chia Pudding,Mango chia pudding with coconut cream and fresh mango,"A creamy mango chia pudding layered with coconut cream and topped with fresh mango.",Dairy (Mascarpone),Gluten Free,436,22,26,11,30
